ThirdParty,URL,SENTENCES
ContentManager,https://github.com/stfalcon-studio/ContentManager,"[<Sentence: Library for getting photos, videos or files of any type from a device gallery, external storage, cloud(Google Drive, Dropbox and etc) or camera.>, <Sentence: With asynchronous load from the cloud and fixed bugs for some problem devices like Samsung or Sony.>, <Sentence: * Call if user manual cancel picking or taking content.>]"
360 Video Player for Android,https://github.com/fbsamples/360-video-player-for-android,"[<Sentence: Imagine teleporting yourself to the most interesting places in the world, training with Lebron James, or speeding across the Jakku desert from Star Wars.>, <Sentence: Touch and drag is supported to adjust the yaw and the pitch to see more of the 360 video.>, <Sentence: Didn't work on the new Android Studio 2.1 Preview 1 emulator (Nexus 5X AVD with HAX enabled).>]"
Amazon ExoPlayer Port,https://github.com/amzn/exoplayer-amazon-port,"[<Sentence: This repository is a port of the ExoPlayer project for Amazon devices.>, <Sentence: for the original project.>, <Sentence: See ""README-ORIGINAL.md"" for the original ExoPlayer README.>]"
exoplayer-textureview,https://github.com/satorufujiwara/exoplayer-textureview,"[<Sentence: Play local videos in assets folder.>, <Sentence: Unless required by applicable law or agreed to in writing, software distributed under the License is distributed on an ""AS IS"" BASIS, WITHOUT WARRANTIES OR CONDITIONS OF ANY KIND, either express or implied.>, <Sentence: Unless required by applicable law or agreed to in writing, software distributed under the License is distributed on an ""AS IS"" BASIS, WITHOUT WARRANTIES OR CONDITIONS OF ANY KIND, either express or implied.>]"
MediaFacade,https://github.com/Drivemode/MediaFacade,"[<Sentence: Facade modules for dealing with complicated MediaStore in a simple way.>, <Sentence: you can add music tracks with this uri.>, <Sentence: you can query images in the specific bucket with this bucketId.>]"
Playlist Core,https://github.com/brianwernick/PlaylistCore,"[<Sentence: Playlist Core is a media playback management library for Android that simplifies playing lists of media (Audio and Video) by providing the service, notification, and other media controls such as Bluetooth devices, Android Wear, and Lock screens.>, <Sentence: The latest AAR (Android Archive) files can be downloaded from.>, <Sentence: Unless required by applicable law or agreed to in writing, software distributed under the License is distributed on an ""AS IS"" BASIS, WITHOUT WARRANTIES OR CONDITIONS OF ANY KIND, either express or implied.>]"
ExoMedia,https://github.com/brianwernick/ExoMedia,"[<Sentence: ExoMedia is a media playback library with similar APIs to the Android MediaPlayer and VideoView that uses the.>, <Sentence: The ExoMedia VideoView can be added in your layout files like any other Android view.>, <Sentence: Unless required by applicable law or agreed to in writing, software distributed under the License is distributed on an ""AS IS"" BASIS, WITHOUT WARRANTIES OR CONDITIONS OF ANY KIND, either express or implied.>]"
Vineyard,https://github.com/hitherejoe/Vineyard,"[<Sentence: The browse fragment is what is used to display the browseable categories, post and options card.>, <Sentence: If this is not enabled then videos will automatically play until the final one in the playlist is reached.>, <Sentence: The functionality of this view is display a video preview of the vine post card that is currently in focus.>]"
NewPipe,https://github.com/theScrabi/NewPipe,"[<Sentence: PUTTING NEWPIPE OR ANY FORK OF IT INTO GOOGLE PLAYSTORE VIOLATES THEIR TERMS OF CONDITIONS.>, <Sentence: Websites are only parsed to fetch required info, so this app can be used on devices without Google services installed.>, <Sentence: Also, you don't need a YouTube account to use NewPipe, which is copylefted libre software.>]"
VideoControllerView,https://github.com/brucetoo/VideoControllerView,"[<Sentence: Swipe up-down left edge of screen to control Brightness.>, <Sentence: Show loading before media prepared(In fact,it's not necessary to build in ControllerView).>, <Sentence: Unless required by applicable law or agreed to in writing, software distributed under the License is distributed on an ""AS IS"" BASIS, WITHOUT WARRANTIES OR CONDITIONS OF ANY KIND, either express or implied.>]"
android-transcoder,https://github.com/ypresto/android-transcoder,"[<Sentence: Hardware accelerated transcoder for Android, written in pure Java.>, <Sentence: Also using native code for Android development can be troublesome because of cross-compiling, architecture compatibility, build time and binary size.>, <Sentence: , which is default repo of gradle script generated by recent android studio.>]"
Voice Recording Visualizer,https://github.com/tyorikan/voice-recording-visualizer,"[<Sentence: Simple Visualizer from mic input for Android.>, <Sentence: @Override protected void onDestroy() { mRecordingSampler.release(); super.onDestroy(); }.>, <Sentence: Unless required by applicable law or agreed to in writing, software distributed under the License is distributed on an ""AS IS"" BASIS, WITHOUT WARRANTIES OR CONDITIONS OF ANY KIND, either express or implied.>]"
FFmpegMediaMetadataRetriever,https://github.com/wseemann/FFmpegMediaMetadataRetriever,"[<Sentence: FFmpegMediaMetadataRetriever is a reimplementation of Android's MediaMetadataRetriever class.>, <Sentence: The FFmpegMediaMetadataRetriever class provides a unified interface for retrieving frame and meta data from an input media file and uses FFmpeg as its backend.>, <Sentence: file, http, https, mms, mmsh and rtmp.>]"
URLMediaPlayer,https://github.com/avafab/URLMediaPlayer,"[<Sentence: Give an mp3 URL and an image URL to Media Player Activity and it will render a nice player for you!>, <Sentence: Copy and paste URLMediaPlayerActivity.java into your code and pass the URLs to it using an intent.>, <Sentence: Unless required by applicable law or agreed to in writing, software distributed under the License is distributed on an ""AS IS"" BASIS, WITHOUT WARRANTIES OR CONDITIONS OF ANY KIND, either express or implied.>]"
YouTubePlayerActivity,https://github.com/TheFinestArtist/YouTubePlayerActivity,"[<Sentence: If the video is not playable, it send to youtube app or other browser which will might play it.>, <Sentence: Show audio interface when user adjust volume (true for default).>, <Sentence: If the video is not playable, use Youtube app or Internet Browser to play it.>]"
OpenSLMediaPlayer,https://github.com/h6ah4i/android-openslmediaplayer,"[<Sentence: android Issue 64423 ""Visualizer with audio session 0 does not always receive all of output mix"".>, <Sentence: Music Visualizer ""Limitations on Galaxy S3, S4 and Note 3 (Snapdragon Quad core model)"".>, <Sentence: Consumes more CPU resources than standard MediaPlayer and other AudioTrack/OpenSL based audio player products (ex.>]"
Mizuu,https://github.com/MizzleDK/Mizuu,"[<Sentence: Enjoy popular video content from YouTube, Reddit as well as the latest TED Talks.>, <Sentence: Browse details and watch trailers for upcoming and popular movies with online search.>, <Sentence: Mizuu uses a number of third-party libraries, which are all included as dependencies or as .jar files in the /app/libs/ folder of this repo.>]"
AndroidRecording,https://github.com/steelkiwi/AndroidRecording,"[<Sentence: custom Visualizer (like bar chart) to represent audio signal on screen while recording and during playback.>, <Sentence: custom SurfaceView with adjustable size to properly display Camera preview and recorded video (in portrait and landscape modes).>, <Sentence: Choose desired video resolution and pass it to RecordingManager, it will adjust size of AdaptiveSurfaceView to properly display Camera output>]"
ExoPlayer,https://github.com/google/ExoPlayer,"[<Sentence: ExoPlayer is an application level media player for Android.>, <Sentence: It provides an alternative to Android’s MediaPlayer API for playing audio and video both locally and over the Internet.>, <Sentence: The easiest way to get started using ExoPlayer is to add it as a gradle dependency.>]"
RxDrive,https://github.com/francescocervone/RxDrive,"[<Sentence: Using Google Drive API for Android can be a little frustrating because sometimes you must define nested callbacks.>, <Sentence: The purpose of RxDrive is to use Google Drive APIs with the elegance and the advantages of RxJava.>, <Sentence: Before you start using this library, you need to follow the instructions to create a new project with Google Drive API access (.>]"
Syncthing,https://github.com/syncthing/syncthing,"[<Sentence: Regardless of our other goals we must never allow the user's data to be susceptible to eavesdropping or modification by unauthorized parties.>, <Sentence: Syncthing is primarily about empowering the individual user with safe, secure and easy to use file synchronization.>, <Sentence: This helps the team understand what are the biggest pain points for our users, and could potentially influence what is being worked on next.>]"
OneDrive-Picker-Android,https://github.com/OneDrive/OneDrive-Picker-Android,"[<Sentence: It provides a set of Java APIs that your app can use to browse, select, open and save files in your user's OneDrive.>, <Sentence: You can either download the latest version directly or clone the repository:.>, <Sentence: For information on configuring your environment to work with the sample applications or the picker SDK see.>]"
Google Drive,https://developers.google.com/drive/android,"[<Sentence: Read, write, and sync files stored in Google Drive from your Android app.>, <Sentence: Explore our sample apps or fork them to build your own.>, <Sentence: Google API Services: User Data Policy.>]"
Driven,https://github.com/bingzer/driven,"[<Sentence: is an effort to unify API calls for different cloud storage providers (i.e: Google Drive, Dropbox, - many more to come).>, <Sentence: Depending on the providers, the remote storage have different file system and the concept of.>, <Sentence: At first Driven was used for GoogleDrive API calls but as requirements grow other providers will be implemented as well.>]"
SnapTimePicker,https://github.com/akexorcist/Android-SnapTimePicker,"[<Sentence: TimeValue - Time data holder that contain hour and minute.>, <Sentence: SnapTimePickerDialog made from DialogFragment (AndroidX) so it need SupportFragmentManager from Activity/Fragment and any string tag.>, <Sentence: For event callback from SnapTimePicker, you have assign the listener after build the SnapTimePickerDialog from builder.>]"
CustomDateTimePicker,https://github.com/noowenz/CustomDateTimePicker,"[<Sentence: CustomDateTimePicker is a A simple Android library for displaying a DateAndTimePicker with From and To ranges as a custom dialog.>, <Sentence: override fun onSet( dialog.>, <Sentence: Unless required by applicable law or agreed to in writing, software distributed under the License is distributed on an ""AS IS"" BASIS, WITHOUT WARRANTIES OR CONDITIONS OF ANY KIND, either express or implied.>]"
timelineview-v2,https://github.com/andob/timelineview-v2,"[<Sentence: With this library, app users can pick DateTime intervals.>, <Sentence: Under the hood, it uses JodaTime library in order to calculate the intervals.>, <Sentence: Each time this property is set, the UI updates and the DateTime interval changed event is triggered.>]"
SingleRowCalendar,https://github.com/miso01/SingleRowCalendar,"[<Sentence: You can create really beautiful and customizable UI and use selection features without hands getting dirty with RecyclerView and SelectionTracker.>, <Sentence: <dependency> <groupId>com.michalsvec</groupId> <artifactId>single-row-calednar</artifactId> <version>1.0.0</version> <type>pom</type> </dependency>.>, <Sentence: 2. create special calendar item view layout files (optional).>]"
CPicker (CalendarPicker),https://github.com/andrewjapar/rangedatepicker,"[<Sentence: A simple vertical date picker for Android, written in kotlin.>, <Sentence: You can customize the picker range (by default current date + 1 year).>, <Sentence: Don't forget to set the listener to get range selection date.>]"
Vertical Scroll Calendar,https://github.com/emcthye/VerticalCalendar,"[<Sentence: Scroll calendar days infinitely in a vertical column.>, <Sentence: that changes the day view's background color.>, <Sentence: You can also implement your own logic by returning.>]"
HR-Vertical-Calender,https://github.com/TecOrb-Developers/HR-Vertical-Calender,"[<Sentence: This awesome calendar is designed to meet more complex business requirements for Android development.>, <Sentence: This calender is more flexible to adapt different ui and the complicated logic.>, <Sentence: The vertical calendar is build with ListView whose child item is CalendarCard with some information text.>]"
Date Picker Timeline,https://github.com/101Loop/DatePickerTimeline,"[<Sentence: An android package that provides a Horizontal Date Picker.>, <Sentence: Set a Start date (Default, 1 Jan 1970).>, <Sentence: This library is also available for flutter check the github repo.>]"
JRDateTimePicker,https://github.com/jrizani/JRDateTimePicker,"[<Sentence: Helper Library to Make Date Time Picker Dialog Easily.>, <Sentence: val dialog = builder.create() //method to create DateTimePicker instance>, <Sentence: etDate.setOnClickListener(new View.OnClickListener() { @Overrid public void onClick(View v) { //method to show dialog, you can directly call show on builder instance like 'builder.show' that also return DateTimePicker instance dialog.show(); } });.>]"
TimePickerCompact,https://github.com/iFr0z/TimePickerCompact,"[<Sentence: A library for easy usage of TimePicker on Android API 21+.>, <Sentence: You may obtain a copy of the License at>, <Sentence: Unless required by applicable law or agreed to in writing, software distributed under the License is distributed on an ""AS IS"" BASIS, WITHOUT WARRANTIES OR CONDITIONS OF ANY KIND, either express or implied.>]"
PrimeCalendar,https://github.com/aminography/PrimeCalendar,"[<Sentence: This library contains three types of calendar systems as well as their conversion to each other.>, <Sentence: Calendar objects can be instantiated by the class constructors or using.>, <Sentence: Conversion of dates to each other is simply possible by calling the converter methods.>]"
PrimeDatePicker,https://github.com/aminography/PrimeDatePicker,"[<Sentence: reads some configurations from the input calendar, so they are reflected to the date picker.>, <Sentence: shows a Persian calendar, but in English language which leads to LTR direction.>, <Sentence: Almost everything is customizable, such as: text size & color, background & element color, padding, font typeface, string formatter, calendar animation & transition parameters,.>]"
Classic Material TimePicker,https://github.com/michaldrabik/classicmaterialtimepicker,"[<Sentence: Simple, customisable Time and Date Picker created in the ""old"" Android API 16 style.>, <Sentence: Use this listener if time picker was initialised in 12-hour format.>, <Sentence: Use this listener if time picker was initialised in 24-hour format.>]"
CalendarView,https://github.com/kizitonwose/CalendarView,"[<Sentence: A highly customizable calendar library for Android, powered by RecyclerView.>, <Sentence: Single or range selection - The library provides the calendar logic which enables you to implement the view whichever way you like.>, <Sentence: Custom date view - make your day cells look however you want, with any functionality you want.>]"
DateRangePicker,https://github.com/savvisingh/DateRangePicker,"[<Sentence: for eg, if you dont want to provide services on Saturday and Sunday you can mark them deactivated in that case the date text color wil be grey.. You can aslo specify custom month header style by passing SimpleDateFormat object in constructor For eg.>, <Sentence: Add this attr in your colors.xml file to override the default colors.>, <Sentence: Unless required by applicable law or agreed to in writing, software distributed under the License is distributed on an ""AS IS"" BASIS, WITHOUT WARRANTIES OR CONDITIONS OF ANY KIND, either express or implied.>]"
Azan,https://github.com/ahmedeltaher/Azan,"[<Sentence: The Muslim call to ritual prayer made by a muezzin from the minaret of a mosque (or now often played from a recording) .>, <Sentence: Azan library enables you to determin latitude, longitude, timezone, height, The Way of Calculation as Inputes.>, <Sentence: UOIF (Union des organisations islamiques de France).>]"
HmsPickerView,https://github.com/DeweyReed/HmsPickerView,"[<Sentence: A beautiful little Android view to pick hours, minutes and seconds.>, <Sentence: * This methods can be used to allow user to go forward (such as enabling ""next"" button).>, <Sentence: * This methods can be used to prevent user from going forward(such as disabling ""next"" button).>]"
Business Hours Picker,https://github.com/bashizip/business-hours-picker,"[<Sentence: Want to add a business hours picker and viewer in your application?>, <Sentence: Feel free to fork or pull requests on github.>, <Sentence: Use it to pick a full week of business days from monday to sunday.>]"
Time Range Picker,https://github.com/dvird/timerangepicker,"[<Sentence: DateTime Picker tries to offer you the date and time pickers as shown in IOS, with an easy themable API.>, <Sentence: (Android 4.0 was supported until 3.6.4) Feel free to fork or issue pull requests on github.>, <Sentence: Add it in your root build.gradle at the end of repositories:.>]"
EventCalender,https://github.com/mahimrocky/EventCalender/,"[<Sentence: This is the simple library of calender, where you can set event on specific date.>, <Sentence: To change week name color (sun,mon etc).>, <Sentence: To change total calender background color.>]"
BottomSheetTimeRangePicker,https://github.com/adawoud/BottomSheetTimeRangePicker,"[<Sentence: BottomSheetPickers is a tiny Android library for adding Date and Time Pickers as Modal BottomSheetDialogs with From and To ranges.>, <Sentence: BottomSheetTimeRangePicker .tabLabels(startTabLabel = ""Hello"", endTabLabel = ""World"") .doneButtonLabel(""Ok"") .startTimeInitialHour(2) .startTimeInitialMinute(11) .endTimeInitialHour(10) .endTimeInitialMinute(22) .newInstance(this, DateFormat.is24HourFormat(this)) .show(supportFragmentManager, tagBottomSheetTimeRangePicker).>, <Sentence: Unless required by applicable law or agreed to in writing, software distributed under the License is distributed on an ""AS IS"" BASIS, WITHOUT WARRANTIES OR CONDITIONS OF ANY KIND, either express or implied.>]"
SlyCalendarView,https://github.com/psinetron/slycalendarview,"[<Sentence: A calendar that allows you to select both a single date and a period.>, <Sentence: Calendar allows you to change colors programmatically without reference to the theme.>, <Sentence: Add the JitPack repository to your build file.>]"
Sleep Schedule Picker,https://github.com/AppSci/SleepTimePicker,[]
WeekDaySelector,https://github.com/mahimrocky/WeekDaySelector,"[<Sentence: allprojects { repositories { ... maven { url.>, <Sentence: To change selected date circle color.>, <Sentence: @Override public void onGetItem(WeekModel model) { Toast.makeText(this,.>]"
SwipePicker,https://github.com/m4xp1/SwipePicker,"[<Sentence: - a widget for Android that allows the user to enter different values, such as: time, date, number, without additional dialog windows using the swipe gestures.>, <Sentence: file into your Android Studio project and add it as a dependency in your.>, <Sentence: convert the string to a value or in case of an error return.>]"
Horizontal Calendar View,https://github.com/mybringback22/HorizontalCalendarView-Android-,"[<Sentence: To change the background color of the Horizontal Calendar View use the following.>, <Sentence: To change the Text color of the Horizontal Calendar View use the following.>, <Sentence: is a custom data class that is used in the library and is returned as the parameter the override method.>]"
LazyDatePicker,https://github.com/lopspower/LazyDatePicker,"[<Sentence: To make a lazy date picker add LazyDatePicker in your layout XML and add LazyDatePicker library in your project or you can also grab it via Gradle:.>, <Sentence: You can override day, month & year if you want like this in your.>, <Sentence: And to finish you can also completely redefine the layout by keeping the same name.>]"
Calendar Date Range Picker,https://github.com/ArchitShah248/CalendarDateRangePicker,"[<Sentence: Add following line to App level gradle:.>, <Sentence: Selected date text circle color.>, <Sentence: Date text color when it falls into range.>]"
Collapsible-Calendar-View-Android,https://github.com/shrikanth7698/Collapsible-Calendar-View-Android,"[<Sentence: Add the JitPack repository to your build file.>, <Sentence: Drop the Collapsible CalendarView in your XML layout as is shown below:.>, <Sentence: Permission is hereby granted, free of charge, to any person obtaining a copy of this software and associated documentation files (the ""Software""), to deal in the Software without restriction, including without limitation the rights to use, copy, modify, merge, publish, distribute, sublicense, and/or sell copies of the Software, and to permit persons to whom the Software is furnished to do so, subject to the following conditions:>]"
SectionCalendarView,https://github.com/WindSekirun/SectionCalendarView,"[<Sentence: Custom CalendarView with selecting StartDay, EndDay for Android Application, written in Java and.>, <Sentence: Copyright 2017 WindSekirun (DongGil, Seo)>, <Sentence: Unless required by applicable law or agreed to in writing, software distributed under the License is distributed on an ""AS IS"" BASIS, WITHOUT WARRANTIES OR CONDITIONS OF ANY KIND, either express or implied.>]"
ScrollHmsPicker,https://github.com/DeweyReed/ScrollHmsPicker,"[<Sentence: set picker's not selected text color.>, <Sentence: set picker's selected text color.>, <Sentence: let picker automatically increment 1 minute if seconds move from 59 to 00 or increment 1 hour if minutes move from 59 to 00. set hours picker visibility.>]"
Range Time Picker Dialog,https://github.com/PuffoCyano/Range-Time-Picker-Dialog,"[<Sentence: Set Color of Background header dialog.>, <Sentence: To read parameter from Dialog your activity have to implements the interface ISelectedTime:.>, <Sentence: When you have to read parameter provided by Dialog you have to override onResultActivity in your fragment:.>]"
HmsPicker,https://github.com/DeweyReed/HmsPicker,"[<Sentence: A simple Hours-Minutes-Seconds time picker.>, <Sentence: (in order to shrink apk size and add features).>, <Sentence: Add the JitPack repository to your build file.>]"
MeowDateTimePicker,https://github.com/oneHamidreza/MeowDateTimePicker,"[<Sentence: Call library init function in Application and refer that in.>, <Sentence: In order to receive the date or time set in the picker, you will need to implement the.>, <Sentence: method, supplying proper default values and a callback.>]"
Simple Date Picker,https://github.com/congfandi/simpleDatePicker,"[<Sentence: Add it in your root build.gradle at the end of repositories:.>, <Sentence: maven { url.>, <Sentence: Add the dependency.>]"
Recurrence Picker,https://github.com/maltaisn/recurpickerlib,"[<Sentence: Fully customizable recurrence picker dialog and fragment, compatible with API 14.>, <Sentence: Easy to set up and to customize, almost every view can be styled with attributes.>, <Sentence: Note that v2 introduced some strings and current translations may not be 100% accurate.>]"
Calendar Picker,https://github.com/maxyou/CalendarPicker,"[<Sentence: v1.1: If no preset day, hide Selected button.>, <Sentence: .setMonthTitle(new Builder.FormatMonthTitle() { @Override public String setMonthTitle(int year, int month) { return """"+year+""年""+month+""月""; } }) .setMonthTitleSize(16) .setMonthTitleColor(0xFFB22222) .setMonthTitleBgColor(0x00000000)>, <Sentence: .setWeekIndex(new String[]{""一"", ""二"", ""三"", ""四"", ""五"", ""六"", ""日""}) .setWeekIndexSize(16) .setWeekIndexColor(0xFFFF00FF) .setWeekIndexBgColor(0x00000000)>]"
AlmostMaterialDatepicker,https://github.com/shagiz/AlmostMaterialDatepicker,"[<Sentence: Date picker made in material design style with some additional spinner for more convenient use.>, <Sentence: To add this library to your project, you must add the JitPack repo to your root build.gradle file... allprojects { repositories {.>, <Sentence: .newInstance({ view, year, monthOfYear, dayOfMonth.>]"
SpinnerDatePicker,https://github.com/drawers/SpinnerDatePicker,"[<Sentence: This repo is no longer being maintained due to time constraints.>, <Sentence: The default Material Design DatePicker has poor usability for choosing a date of birth.>, <Sentence: The previous Holo DatePicker with sliding NumberPickers is much more suitable for this use case however it is no longer available for Marshmallow devices and up.>]"
Linear Time Picker,https://github.com/code-mc/linear-time-picker,"[<Sentence: Gorgeous Time and Date picker library inspired by the.>, <Sentence: Public API you can use to create your own Linear Picker View.>, <Sentence: Show a short 10 second automated tutorial to onboard the user.>]"
ScrollCalendar,https://github.com/RafalManka/ScrollCalendar,"[<Sentence: If you don't declare this value, no behavior will be applied and you should use callbacks to control the calendar as described further on in this readme.>, <Sentence: Each state can be expressed by applying specific drawable background and a text color.>, <Sentence: In order to display ranges properly you need to set Beginning, middle and end drawables according to your style.>]"
